{
  "schema_version": "chaptera.windows-support-matrix.v1",
  "product_id": "chaptera.reader",
  "release_scope": "public-v0",
  "public_copy": {
    "claim_state": "pre_release_candidate",
    "baseline": "Windows 11 25H2 x64",
    "required_edition_receipts": ["Pro"],
    "fixed_display_scales_percent": [100, 150],
    "mixed_dpi_transition_support": false,
    "arm64_native_support": false
  },
  "ci_evidence": {
    "github_runner_label": "windows-latest",
    "expected_runner_family": "Windows Server 2025",
    "consumer_support_claim": false
  },
  "cells": [
    {"os":"Windows 11","version":"25H2","edition":"Pro","architecture":"x86_64","state":"candidate","separate_receipt_required":true,"required_evidence":["physical_or_vm_product_receipt","reader_open_read_only","fixed_scale_100","fixed_scale_150"]},
    {"os":"Windows 11","version":"25H2","edition":"Home","architecture":"x86_64","state":"candidate","separate_receipt_required":true,"required_evidence":["physical_or_vm_product_receipt","reader_open_read_only","fixed_scale_100","fixed_scale_150"]},
    {"os":"Windows 11","version":"24H2","edition":"Pro","architecture":"x86_64","state":"compatibility_only","separate_receipt_required":true,"note":"May retain compatibility evidence while serviced; not the durable Public V0 launch baseline."},
    {"os":"Windows 11","version":"24H2","edition":"Home","architecture":"x86_64","state":"compatibility_only","separate_receipt_required":true,"note":"May retain compatibility evidence while serviced; not the durable Public V0 launch baseline."},
    {"os":"Windows 10","version":"22H2","edition":"any","architecture":"x86_64","state":"excluded","separate_receipt_required":false,"note":"Outside the default public support promise."},
    {"os":"Windows 11","version":"26H1","edition":"any","architecture":"x86_64","state":"evaluation_only","separate_receipt_required":true,"note":"Hardware-specific/evaluation-only until proven on supported 26H1 hardware."},
    {"os":"Windows 11","version":"25H2","edition":"any","architecture":"arm64","state":"evaluation_only","separate_receipt_required":true,"note":"Hosted CI is compile-only preflight; native ARM64 support requires native package/sign/sandbox/render/update acceptance."},
    {"os":"Windows Server","version":"2025","edition":"GitHub-hosted","architecture":"x86_64","state":"ci_only","separate_receipt_required":false,"note":"GitHub-hosted CI mechanics evidence only; never a consumer-Windows support claim."}
  ]
}
